ID,Title,Total Entities,Total Features,Total States,Scored Entities,Discrete Characters,Numeric Characters,Grouping Characters,Download URL,Downloaded At
a958fd46-1327-46a2-ad14-47bce05988cf,Key to Brassicaceae in Victoria,107,43,92,92,26,5,12,https://vicflora-cdn.rbg.vic.gov.au/lucid-keys/brassicaceae.js,2025-09-18T09:20:46.430Z
115cc464-6167-4b50-9c3a-72f0bc8ff745,Multiaccess key to families of flowering plants in Victoria_updated Aug 2022,167,87,307,307,70,0,17,https://vicflora-cdn.rbg.vic.gov.au/lucid-keys/magnoliopsida.js,2025-09-18T09:20:48.581Z
2aca28ae-4324-47d1-a43f-d20522e72fea,Multiaccess key to the Fabaceae of Victoria,310,62,178,178,43,7,12,https://vicflora-cdn.rbg.vic.gov.au/lucid-keys/fabaceae.js,2025-09-18T09:20:50.059Z
f0df3b5c-b214-4b09-8cdc-beaac7722092,Multiaccess key to the Cyperaceae of Victoria,206,30,60,60,11,7,12,https://vicflora-cdn.rbg.vic.gov.au/lucid-keys/cyperaceae.js,2025-09-18T09:20:53.595Z
d2a3243e-22e9-41cc-85f2-46b5c4799629,Multiaccess key to the Juncaceae of Victoria,62,32,36,36,10,8,14,https://vicflora-cdn.rbg.vic.gov.au/lucid-keys/juncaceae.js,2025-09-18T09:21:02.296Z
f4e1046d-d53b-4f98-920c-4e4c18d75db8,Key to the eucalypts of Victoria2,159,92,265,265,70,11,11,https://vicflora-cdn.rbg.vic.gov.au/lucid-keys/eucalypts.js,2025-09-18T09:21:08.510Z